{
  "$schema": "https://baton.sawy3r.net/schemas/llm-check-report-v1.json",
  "schema_version": 1,
  "check": "maintainability-review",
  "slice_id": "S19-s02-v015-rollback",
  "release": "2026-07-15-baton-v0.15-conformance",
  "role": "implementer",
  "phase": "preflight",
  "cycle": 0,
  "invocation_id": "73909151-0ead-4f0b-8cca-c1b4e78e6fdf",
  "input_fingerprint": "sha256:fb4c8849e66b1507b6dc19b353b104ae69f3df2c4e07a899b1fb881d99482214",
  "review_scope": {
    "base": "640396fa8cc319229d6f96dedfdbef65dbe317fe",
    "head": "4b38887e666f7e4ab664bac4780535b080ad54eb",
    "included_paths": [
      "cmd/sworn/baton.go",
      "cmd/sworn/baton_test.go",
      "cmd/sworn/doctor.go",
      "cmd/sworn/doctor_test.go",
      "internal/adopt/baton/README.md",
      "internal/adopt/baton/VERSION",
      "internal/adopt/baton/architecture.json",
      "internal/adopt/baton/installer-input-v0.15.1.tar",
      "internal/adopt/baton/rules/07-adversarial-verification.md",
      "internal/adopt/baton/rules/10-customer-journey-validation.md",
      "internal/adopt/baton_archive.go",
      "internal/baton/diff.go",
      "internal/baton/install_transaction.go",
      "internal/baton/install_transaction_test.go",
      "internal/baton/installer_archive.go",
      "internal/baton/installer_archive_test.go",
      "internal/baton/manifest.go",
      "internal/baton/manifest_test.go",
      "internal/baton/records_conformance_test.go",
      "internal/baton/schemas/board-v1.json",
      "internal/baton/schemas/embed.go",
      "internal/baton/schemas/llm-check-report-v1.json",
      "internal/baton/schemas/slice-status-v1.json",
      "internal/baton/schemas/spec-ambiguity-report-v1.json",
      "internal/baton/schemas/spec-v1.json",
      "internal/baton/source.go",
      "internal/baton/testdata/fixture/schemas/spec-ambiguity-report-v1.json",
      "internal/baton/validate_schema_test.go",
      "internal/baton/vendor.go",
      "internal/baton/vendor_transaction.go",
      "internal/baton/vendor_transaction_test.go",
      "internal/gate/llmcheck_test.go",
      "internal/prompt/baton/README.md",
      "internal/prompt/baton/llm-checks/README.md",
      "internal/prompt/baton/llm-checks/maintainability-review.md",
      "internal/prompt/baton/llm-checks/spec-ambiguity.md",
      "internal/prompt/baton/rules.md",
      "internal/prompt/baton/track-mode.md",
      "internal/prompt/implementer.md",
      "internal/prompt/planner.md",
      "internal/prompt/verifier.md",
      "internal/run/slice_test.go",
      "internal/state/record_reconciliation_test.go",
      "internal/state/state.go",
      "internal/state/state_test.go"
    ],
    "excluded_paths": [
      "docs/release/2026-07-15-baton-v0.15-conformance/S19-s02-v015-rollback/proof/check-rollback.sh",
      "docs/release/2026-07-15-baton-v0.15-conformance/S19-s02-v015-rollback/status.json"
    ],
    "fingerprint_algorithm": "baton-maintainability-v1"
  },
  "verdict": "PASS",
  "findings": []
}
